<?xml version="1.0" encoding="UTF-8"?>
<!DOCTYPE Filmographie SYSTEM "EX3.dtd">

<Filmographie date="2023-09-25" nom="amin">
    <film>
        <titre>titre 1</titre>
        <acteur>acteur 1</acteur>
    </film>
    <film>
        <titre>titre2</titre>
        <acteur>acteur 2</acteur>
        <genre>Action</genre>
    </film>
    
</Filmographie>